{
  "recipe_id": "openfoam_steady_internal_flow",
  "schema_version": "1.0.0",
  "title": "OpenFOAM steady internal flow",
  "task_class": "steady_internal_flow",
  "assumptions": ["Turbulence model selected upstream"],
  "why_this_stack": "OpenFOAM provides robust finite-volume CFD case orchestration.",
  "knowledge_pack_ref": "artifact://knowledge-pack/openfoam",
  "touched_objects": [
    { "name": "controlDict", "role": "Run control", "notes": "Sets solver cadence" }
  ],
  "implementation_pattern": ["Prepare mesh", "Run checkMesh", "Solve", "Inspect residuals"],
  "required_inputs": ["Mesh", "Boundary conditions"],
  "required_outputs": ["Converged field set"],
  "failure_signatures": ["Residual divergence", "Bad cell quality"],
  "acceptance_tests": ["Residuals decrease monotonically"],
  "adapter_refs": ["artifact://execution-adapter-spec/openfoam/default"],
  "evidence_refs": ["artifact://evidence-bundle/openfoam/default"]
}
